questionId	title	tags	difficulty	date	viewsCount	signersCount	solutionsCount	answersCount	askerNickname	respondents	descriptionLength21	Редирект в зависимости от User Agent средствами Apache	iphone, apache	Оценить	2010-09-02 22:37:36	5283 	6	1	2	MaEcTPo	['Nevostruev', 'WarGoth', 'DeNn']	19322	Hibernate custom loader query	hibernate	Оценить	2010-09-02 22:53:08	3014 	2	0	0	SkywalkerY	[]	372923	Все увеличивающаяся задержка при логине по ssh в ubuntu server?	ssh, ubuntu	Оценить	2010-09-02 22:54:11	3369 	3	1	4	homm	['andoriyu', 'AmdY', 'DeNn', 'proDOOMman', 'asukafag']	26224	Посоветуйте толковую книгу по Java EE 6	java, книги, it-образование	Оценить	2010-09-02 22:56:20	12477 	21	1	6	unkind	['Drevlyanin', 'aymeshkov', 'Coder89', 'krestjaninoff', 'FanKiLL', 'FanKiLL', 'andy-007']	19725	Что будет если в унитаз поезда на полном ходу бросить лом		Оценить	2010-09-02 22:57:11	3158 	3	0	4	WarGoth	['Nc_Soft', 'andreevich', 'Nc_Soft', 'lasthero']	14626	Ограничить скорость на выполнение определенных внешних запросов?	client-side-optimization	Оценить	2010-09-02 22:57:20	2776 	2	1	0	FFF	['aymeshkov']	83027	Кто уже пробовал, что посоветуете по изучению Groovy (литература, сайты)?	grails	Оценить	2010-09-02 23:11:06	3361 	3	0	5	CyMpak	['thevery', 'buddy', 'folone', 'Kumarunster', 'qtask']	22730	Мобильные устройства, вредно ли их постоянно держать на подзарядке?	ipad, мобильные-устройства, аккумуляторные-батареи	Оценить	2010-09-02 23:17:25	171041 	13	0	20	CyberCore	['Ving', 'mythmaker', 'XEK', 'FFF', 'liveor', 'younext', 'Mezya', 'Nazarii', 'Pas', 'beatlejute', 'Mindstorms', 'ShadowMaster', 'Rayzor', 'adminimus', 'BombilCalabasov', 'shkluar', 'virtustilus', 'mvs3d', 'andrii3003', 'MasterPeaceMC']	43331	Вёрстка. Как реализовать border внутри блока, а не на его границе? Пример в описании	css, html	Оценить	2010-09-02 23:36:23	48698 	9	1	3	NeOn4eG	['CaptainQuazar', 'Serator', 'homm', 'zibada']	208